{
  "$schema": "https://eyelock.github.io/ynh/schema/plugin.schema.json",
  "name": "ynh-guide",
  "version": "0.1.0",
  "description": "AI harness management \u2014 your name, your AI",
  "author": {
    "name": "eyelock",
    "url": "https://github.com/eyelock"
  },
  "keywords": [
    "harness",
    "ai",
    "skills",
    "meta"
  ],
  "default_vendor": "claude",
  "profiles": {
    "ynh-dev": {
      "hooks": {
        "before_tool": [
          {
            "matcher": "Bash",
            "command": "sh -c 'case \"$YNH_TOOL_INPUT\" in *\"git push\"*|*\"gh pr create\"*|*\"gh pr merge\"*) echo \"Reminder: .claude/rules/pre-remote.md requires make check + /evals before remote operations\" >&2 ;; esac; exit 0'"
          }
        ],
        "on_stop": [
          {
            "command": "sh -c 'ynh sensors ls local/ynh-guide >/dev/null 2>&1 || { echo \"ynh-dev: run \\`ynh install .\\` to enable the fmt sensor on stop\" >&2; exit 0; }; ynh check local/ynh-guide --only fmt'"
          }
        ]
      },
      "includes": [
        {
          "local": ".claude"
        }
      ]
    }
  },
  "focuses": {
    "learn": {
      "prompt": "Walk me through ynh as a first-time user, starting from the README.md. Introduce the core concepts \u2014 harnesses, vendors, includes, delegates \u2014 with a concrete example for each. When I'm ready, suggest I use /ynh-create-harness to build my own."
    },
    "create": {
      "prompt": "Use the ynh-create-harness skill to help me build a new harness. Ask what I do, what languages and tools I use, and what standards my team follows. Scaffold it with ynd create harness and install it so I can try it immediately."
    },
    "team": {
      "prompt": "Use the ynh-team-setup skill to set up a team harness. We'll build a parent harness that delegates to personal team members' harnesses. Explain delegation as we go."
    },
    "validate": {
      "prompt": "Validate the harness in the current working directory with ynd validate. If issues are found, walk through each one and help me fix it. If it's valid, run ynd preview so I can see the assembled vendor output."
    },
    "contribute": {
      "profile": "ynh-dev",
      "prompt": "I want to contribute to ynh. Start by reading .claude/CLAUDE.md and the rules under .claude/rules/. Ask what I want to change \u2014 a bug fix, a new feature, a doc update \u2014 then help me follow the branching rules in .claude/rules/branching.md and the pre-remote gates in .claude/rules/pre-remote.md."
    },
    "release": {
      "profile": "ynh-dev",
      "prompt": "Walk me through preparing a ynh release. Confirm we are on develop, run /evals to gate the release, update the changelog, then create a release PR per .claude/rules/branching.md. The full sequence is documented in .claude/commands/release.md."
    }
  },
  "sensors": {
    "fmt": {
      "category": "maintainability",
      "tolerance": "blocking",
      "source": {
        "command": "sh -c 'out=$(gofmt -l cmd internal); if [ -n \"$out\" ]; then echo \"unformatted:\" >&2; echo \"$out\" >&2; echo \"fix with: make format\" >&2; exit 1; fi'"
      },
      "output": {
        "format": "text"
      }
    },
    "vet": {
      "category": "maintainability",
      "tolerance": "advisory",
      "source": {
        "command": "go vet ./..."
      },
      "output": {
        "format": "text"
      }
    },
    "check": {
      "category": "behaviour",
      "tolerance": "blocking",
      "source": {
        "command": "make check"
      },
      "output": {
        "format": "text"
      }
    }
  }
}
