{
  "$schema": "https://eyelock.github.io/ynh/schema/plugin.schema.json",
  "name": "conformance-never-converges",
  "version": "0.1.0",
  "description": "ynr conformance: a harness whose one blocking sensor always fails, so a run ends at its turn cap.",
  "default_vendor": "claude",
  "sensors": {
    "always-fails": {
      "category": "behaviour",
      "source": {
        "command": "false"
      },
      "output": {
        "format": "text"
      }
    }
  }
}
